{
  "$id": "bureau_visual_sequence_v1.schema.json", "$schema": "https://json-schema.org/draft/2020-12/schema",
  "type": "object", "additionalProperties": false,
  "required": ["schema_version", "artifact_type", "artifact_id", "property_id", "episode_id", "created_at", "generator_version", "upstream_artifacts", "sequence_profile", "target_duration_ms", "shots"],
  "properties": {
    "schema_version": {"$ref": "common_defs_v1.schema.json#/$defs/schema_version"}, "artifact_type": {"const": "bureau_visual_sequence_v1"}, "artifact_id": {"$ref": "common_defs_v1.schema.json#/$defs/artifact_id"}, "property_id": {"$ref": "common_defs_v1.schema.json#/$defs/property_id"}, "episode_id": {"$ref": "common_defs_v1.schema.json#/$defs/episode_id"}, "created_at": {"$ref": "common_defs_v1.schema.json#/$defs/created_at"}, "generator_version": {"$ref": "common_defs_v1.schema.json#/$defs/generator_version"}, "upstream_artifacts": {"$ref": "common_defs_v1.schema.json#/$defs/upstream_artifacts"},
    "sequence_profile": {"enum": ["standard_short", "approved_extended_short"]}, "target_duration_ms": {"type": "integer", "minimum": 45000, "maximum": 60000},
    "shots": {"type": "array", "minItems": 7, "maxItems": 11, "items": {
      "type": "object", "additionalProperties": false,
      "required": ["shot_id", "sequence_index", "role", "duration_ms", "environment", "subject", "action", "movement", "camera", "framing", "lens_behavior", "lighting", "palette", "materials", "weather", "scale", "graphic_overlays", "narration_segment_id", "sound_cues", "transition", "continuity_tokens", "entity_state", "generation_intent", "negative_constraints", "caption_safe_composition", "thumbnail_eligible"],
      "properties": {
        "shot_id": {"type": "string", "pattern": "^shot_[0-9]{2}$"}, "sequence_index": {"type": "integer", "minimum": 1, "maximum": 11}, "role": {"enum": ["hook", "instructional_diagram", "archival_observation", "impossible_wide", "intimate_detail", "procedure", "escalation", "reveal", "iconic_thumbnail", "bureau_signoff", "transition_world"]}, "duration_ms": {"type": "integer", "minimum": 2000, "maximum": 10000}, "environment": {"$ref": "common_defs_v1.schema.json#/$defs/slug"}, "subject": {"$ref": "common_defs_v1.schema.json#/$defs/nonempty_string"}, "action": {"$ref": "common_defs_v1.schema.json#/$defs/nonempty_string"}, "movement": {"$ref": "common_defs_v1.schema.json#/$defs/nonempty_string"}, "camera": {"$ref": "common_defs_v1.schema.json#/$defs/slug"}, "framing": {"$ref": "common_defs_v1.schema.json#/$defs/nonempty_string"}, "lens_behavior": {"$ref": "common_defs_v1.schema.json#/$defs/nonempty_string"}, "lighting": {"$ref": "common_defs_v1.schema.json#/$defs/nonempty_string"}, "palette": {"$ref": "common_defs_v1.schema.json#/$defs/tag_list"}, "materials": {"$ref": "common_defs_v1.schema.json#/$defs/tag_list"}, "weather": {"$ref": "common_defs_v1.schema.json#/$defs/nonempty_string"}, "scale": {"enum": ["intimate", "human", "room", "architectural", "city", "planetary", "cosmic", "variable"]}, "graphic_overlays": {"type": "array", "items": {"$ref": "common_defs_v1.schema.json#/$defs/nonempty_string"}, "maxItems": 10}, "narration_segment_id": {"$ref": "common_defs_v1.schema.json#/$defs/slug"}, "sound_cues": {"$ref": "common_defs_v1.schema.json#/$defs/string_list"}, "transition": {"$ref": "common_defs_v1.schema.json#/$defs/nonempty_string"}, "continuity_tokens": {"$ref": "common_defs_v1.schema.json#/$defs/tag_list"}, "entity_state": {"$ref": "common_defs_v1.schema.json#/$defs/slug"}, "generation_intent": {"enum": ["image", "video", "graphic", "hybrid"]}, "negative_constraints": {"$ref": "common_defs_v1.schema.json#/$defs/string_list"}, "caption_safe_composition": {"const": true}, "thumbnail_eligible": {"type": "boolean"}
      }
    }}
  }
}
