{
  "schema_version": "itb_artifact_v1",
  "artifact_type": "bureau_visual_sequence_v1",
  "artifact_id": "itb_ep_001_visual_sequence_v1",
  "property_id": "interstitial_travel_bureau",
  "episode_id": "itb_ep_001",
  "created_at": "2026-08-02T00:07:00Z",
  "generator_version": "itb_authored_pilot_v1",
  "upstream_artifacts": [
    {"artifact_id": "itb_ep_001_episode_script_v1", "sha256": "ebafe9c68ca770a938bbf3a0406cc6c0d018f4a2be13d3dc849858ae6c5a141d"},
    {"artifact_id": "itb_ep_001_world_dossier_v1", "sha256": "b20776a8c493108197474fb28dfd9b30ef34ba1151a155b821bb9ba396d85504"},
    {"artifact_id": "itb_ep_001_entity_sheet_v1", "sha256": "3a2d9c41ccd7f4783932a57389a843e2f29397a6d21c57acca53e9ce19e92445"}
  ],
  "sequence_profile": "approved_extended_short",
  "target_duration_ms": 60000,
  "shots": [
    {
      "shot_id": "shot_01", "sequence_index": 1, "role": "hook", "duration_ms": 5000,
      "environment": "mirror_customs_hall", "subject": "A standing traveler seen from behind and the same reflection already facing camera inside smoked glass.", "action": "The reflection finishes one blink before the traveler stops at the yellow inspection line.", "movement": "Traveler coat settles naturally; reflected shoulders settle 500 milliseconds early; mercury rim climbs against gravity.", "camera": "locked_symmetrical_push", "framing": "Vertical medium-wide with traveler centered low and waiting reflection centered high inside the panel.", "lens_behavior": "Slow five-percent optical push with straight architectural lines and no digital warp.", "lighting": "Overhead cream fluorescents; amber CRT catchlights appear only in reflected eyes.", "palette": ["oxidized_teal", "amber_phosphor", "mercury_silver", "cream_fluorescent"], "materials": ["smoked_glass", "chronometric_silver", "wool_coat", "teal_tile"], "weather": "Upward condensation pauses during the early blink.", "scale": "human", "graphic_overlays": ["OPTICAL VARIANCE: EARLY ARRIVAL"], "narration_segment_id": "narration_01", "sound_cues": ["Music drops for 600 milliseconds.", "One polite descending warning chime."], "transition": "Hard optical splice on the reflection's completed blink.", "continuity_tokens": ["amber_eye_catchlight", "mercury_edge_rim", "one_beat_early", "correct_mirror_geometry"], "entity_state": "independent_waiting", "generation_intent": "video", "negative_constraints": ["No horror face distortion.", "No incorrect left-right mirror geometry.", "No extra people or duplicate bodies outside glass."], "caption_safe_composition": true, "thumbnail_eligible": false
    },
    {
      "shot_id": "shot_02", "sequence_index": 2, "role": "impossible_wide", "duration_ms": 5000,
      "environment": "arrival_walkway", "subject": "The physical twelve-meter Annex and its reflection extending as a kilometer-long terminal.", "action": "Amber counter 001 advances while one teal floor tile telescopes out of the physical corridor.", "movement": "Rubber walkway moves toward camera; reflected walkway remains fixed; condensation travels upward.", "camera": "high_corner_observation", "framing": "Extreme vertical wide showing traveler as a small figure beneath nine mirror panels.", "lens_behavior": "Deep-focus 24-millimeter geometry with reflected vanishing point impossibly distant but structurally straight.", "lighting": "Cream ceiling baffles alternate with amber pools; mirror depth falls into cyan haze.", "palette": ["teal_tile", "amber_counter", "cyan_depth", "cream_baffle"], "materials": ["ribbed_rubber", "brushed_aluminum", "smoked_glass", "acoustic_fiber"], "weather": "Ozone draft lifts a paper corner toward a closed window.", "scale": "architectural", "graphic_overlays": ["LIMINAL ARRIVALS ANNEX", "REFLECTED DISTANCE NOT TO SCALE"], "narration_segment_id": "narration_02", "sound_cues": ["Six-hertz walkway thrum.", "CRT relay clicks before number change."], "transition": "Iris down into a Bureau diagram circle.", "continuity_tokens": ["mercury_edge_rim", "correct_mirror_geometry", "one_beat_early"], "entity_state": "leading", "generation_intent": "video", "negative_constraints": ["No curving funhouse mirror.", "No neon cyberpunk city.", "No spatially incoherent architecture."], "caption_safe_composition": true, "thumbnail_eligible": false
    },
    {
      "shot_id": "shot_03", "sequence_index": 3, "role": "instructional_diagram", "duration_ms": 5500,
      "environment": "bureau_optical_diagram", "subject": "Cream field diagram of traveler, mirror plane, ninety-degree viewing cone, and a second amber timeline cursor.", "action": "The amber reflected cursor advances 500 milliseconds ahead, borrows one DECISION token, then stops.", "movement": "Mechanical vector arrows step in four discrete optical-printer increments.", "camera": "orthographic_instructional", "framing": "Flat full-frame diagram with captions protected in the middle sixty percent.", "lens_behavior": "No perspective; slight gate weave limited to two pixels.", "lighting": "Even cel illumination with amber phosphor bloom around the early cursor.", "palette": ["bureau_cream", "oxidized_teal", "warning_amber", "graphite_black"], "materials": ["painted_cel", "graphite_label", "crt_phosphor", "optical_film"], "weather": "Not applicable; visible dust moves only between optical layers.", "scale": "variable", "graphic_overlays": ["BORROWED DECISION: 1", "VIEWING CONE: 90 DEGREES", "OFFSET: 0.5 SECONDS"], "narration_segment_id": "narration_03", "sound_cues": ["Dry relay ticks for each diagram step.", "Soft vibraphone note under DECISION token."], "transition": "Diagram's teal cone becomes the floor's yellow inspection wedge.", "continuity_tokens": ["one_beat_early", "correct_mirror_geometry", "amber_eye_catchlight"], "entity_state": "leading", "generation_intent": "graphic", "negative_constraints": ["No unreadable pseudo-text.", "No three-dimensional perspective.", "No arbitrary glitch effects."], "caption_safe_composition": true, "thumbnail_eligible": false
    },
    {
      "shot_id": "shot_04", "sequence_index": 4, "role": "archival_observation", "duration_ms": 5000,
      "environment": "archive_screening_room", "subject": "Grainy Bureau training footage of a 1960s traveler waving toward an already-seated reflection.", "action": "A gloved clerk stamps ACKNOWLEDGED across the frame before the traveler's hand reaches shoulder height.", "movement": "Hand-cranked footage jitters at eighteen frames per second while stamp animation remains perfectly steady.", "camera": "archival_tripod", "framing": "Square archival insert within a rounded CRT bezel and teal inspection labels.", "lens_behavior": "Slight edge softness, halation on white gloves, stable human proportions.", "lighting": "Flat institutional tungsten with silver flare confined to mirror edges.", "palette": ["faded_salmon", "teal_label", "tungsten_cream", "silver_flare"], "materials": ["silver_gelatin_film", "ribbed_crt_glass", "salmon_stamp_ink", "white_cotton_glove"], "weather": "Film dust and one vertical emulsion scratch; no digital noise.", "scale": "room", "graphic_overlays": ["ARCHIVE CASE 44-R", "DO NOT GREET"], "narration_segment_id": "narration_04", "sound_cues": ["Projector sprocket chatter.", "Muted rubber stamp impact."], "transition": "Stamped diagonal becomes the traveler's sideways path arrow.", "continuity_tokens": ["mercury_edge_rim", "one_beat_early", "correct_mirror_geometry"], "entity_state": "independent_waiting", "generation_intent": "hybrid", "negative_constraints": ["No gore or panic.", "No modern clothing logos.", "No imitation of a known film or television property."], "caption_safe_composition": true, "thumbnail_eligible": false
    },
    {
      "shot_id": "shot_05", "sequence_index": 5, "role": "intimate_detail", "duration_ms": 5500,
      "environment": "mirror_customs_hall", "subject": "Close detail of the traveler's eye crossing out of the silver viewing cone while the reflected eye stays amber-lit.", "action": "The physical pupil exits frame; the reflected pupil tracks once, then freezes.", "movement": "One deliberate lateral head movement; condensation beads climb across glass in the opposite direction.", "camera": "macro_profile_track", "framing": "Split composition: physical eye at left edge, two-millimeter mercury meniscus and reflected eye at right.", "lens_behavior": "Ninety-millimeter macro with shallow depth isolated on eyelashes, glass edge, and amber catchlight.", "lighting": "Soft cream cheek light and narrow amber rectangle reflected in the iris.", "palette": ["warm_skin", "amber_catchlight", "cold_mercury", "teal_blur"], "materials": ["human_skin", "eyelash", "chronometric_silver", "condensation_bead"], "weather": "Condensation rises at constant speed along the panel seam.", "scale": "intimate", "graphic_overlays": ["STEP OUTSIDE THE SILVERED CONE"], "narration_segment_id": "narration_05", "sound_cues": ["Room tone narrows to one fluorescent ballast hum.", "Soft shoe slide on tile."], "transition": "Three circular catchlights become three numbered blink-verifier lenses.", "continuity_tokens": ["amber_eye_catchlight", "mercury_edge_rim", "correct_mirror_geometry"], "entity_state": "contained", "generation_intent": "video", "negative_constraints": ["No eye deformation.", "No beauty-commercial lighting.", "No contact between skin and glass."], "caption_safe_composition": true, "thumbnail_eligible": false
    },
    {
      "shot_id": "shot_06", "sequence_index": 6, "role": "procedure", "duration_ms": 5000,